{
  "schema_version": 1,
  "id": "xiangli_yao",
  "name": {
    "en": "Xiangli Yao"
  },
  "rarity": 5,
  "element": "electro",
  "weapon_type": "gauntlets",
  "profile": {
    "description": {
      "en": "He is the Principal Investigator in charge of the academics at Huaxu Academy's Jinzhou Campus. He is the Academy's youngest multi-disciplinary scientist, and an expert in the research of Automata Mechanics."
    },
    "max_level_stats": {
      "level": 90,
      "hp": 10625.0,
      "attack": 425.0,
      "defense": 1222.2
    },
    "source": {
      "site": "Wuthering Waves Wiki",
      "page_url": "https://wutheringwaves.fandom.com/wiki/Xiangli_Yao",
      "verified_at": "2026-10-02",
      "overview_revision_id": 141812,
      "stats_module_url": "https://wutheringwaves.fandom.com/wiki/Module%3AResonator_Ascensions_and_Stats%2Fdata",
      "stats_module_revision_id": 145096
    }
  },
  "source": {
    "site": "Prydwen.gg",
    "verified_at": "2026-08-28",
    "page_last_updated": "2026-08-20"
  },
  "convene_draw": "characters/xiangli_yao/convene_draw.png"
}
