{
  "schema_version": 1,
  "id": "aalto",
  "name": {
    "en": "Aalto"
  },
  "rarity": 4,
  "element": "aero",
  "weapon_type": "pistols",
  "profile": {
    "description": {
      "en": "He is an information broker from the New Federation and a Consultant of the Black Shores."
    },
    "max_level_stats": {
      "level": 90,
      "hp": 9850.0,
      "attack": 262.5,
      "defense": 1075.54
    },
    "source": {
      "site": "Wuthering Waves Wiki",
      "page_url": "https://wutheringwaves.fandom.com/wiki/Aalto",
      "verified_at": "2026-10-02",
      "overview_revision_id": 141814,
      "stats_module_url": "https://wutheringwaves.fandom.com/wiki/Module%3AResonator_Ascensions_and_Stats%2Fdata",
      "stats_module_revision_id": 145096
    }
  },
  "source": {
    "site": "Prydwen.gg",
    "verified_at": "2026-08-28",
    "page_last_updated": "2026-08-20"
  },
  "convene_draw": "characters/aalto/convene_draw.png"
}
