{
  "schema_version": 1,
  "id": "zani",
  "name": {
    "en": "Zani"
  },
  "rarity": 5,
  "element": "spectro",
  "weapon_type": "gauntlets",
  "profile": {
    "description": {
      "en": "She is a staff member of the Montelli Family's Averardo Bank in Ragunna. As a serious and reliable Montelli employee, Zani follows a strict routine and manages tasks with ease. For years, she has clocked in on time without fail, finding as much enjoyment in her well-ordered life as in her carefully planned moments of leisure."
    },
    "max_level_stats": {
      "level": 90,
      "hp": 10775.0,
      "attack": 437.5,
      "defense": 1136.65
    },
    "source": {
      "site": "Wuthering Waves Wiki",
      "page_url": "https://wutheringwaves.fandom.com/wiki/Zani",
      "verified_at": "2026-10-02",
      "overview_revision_id": 96620,
      "stats_module_url": "https://wutheringwaves.fandom.com/wiki/Module%3AResonator_Ascensions_and_Stats%2Fdata",
      "stats_module_revision_id": 145096
    }
  },
  "source": {
    "site": "Prydwen.gg",
    "verified_at": "2026-08-28",
    "page_last_updated": "2026-08-20"
  },
  "convene_draw": "characters/zani/convene_draw.png"
}
