{
  "schema_version": 1,
  "id": "lingyang",
  "name": {
    "en": "Lingyang"
  },
  "rarity": 5,
  "element": "glacio",
  "weapon_type": "gauntlets",
  "profile": {
    "description": {
      "en": "He is a member of the Liondance Troupe in Jinzhou and the last living Suan'ni."
    },
    "max_level_stats": {
      "level": 90,
      "hp": 10387.5,
      "attack": 437.5,
      "defense": 1209.98
    },
    "source": {
      "site": "Wuthering Waves Wiki",
      "page_url": "https://wutheringwaves.fandom.com/wiki/Lingyang",
      "verified_at": "2026-10-02",
      "overview_revision_id": 92944,
      "stats_module_url": "https://wutheringwaves.fandom.com/wiki/Module%3AResonator_Ascensions_and_Stats%2Fdata",
      "stats_module_revision_id": 145096
    }
  },
  "source": {
    "site": "Prydwen.gg",
    "verified_at": "2026-08-28",
    "page_last_updated": "2026-08-20"
  },
  "convene_draw": "characters/lingyang/convene_draw.png"
}
