{
  "schema_version": 1,
  "id": "zhezhi",
  "name": {
    "en": "Zhezhi"
  },
  "rarity": 5,
  "element": "glacio",
  "weapon_type": "rectifier",
  "profile": {
    "description": {
      "en": "She is a commissioned painter, quiet and shy with a dedication to her craft. She's not very eloquent, but her persistence and love for painting speak volumes."
    },
    "max_level_stats": {
      "level": 90,
      "hp": 12250.0,
      "attack": 375.0,
      "defense": 1197.76
    },
    "source": {
      "site": "Wuthering Waves Wiki",
      "page_url": "https://wutheringwaves.fandom.com/wiki/Zhezhi",
      "verified_at": "2026-10-02",
      "overview_revision_id": 99236,
      "stats_module_url": "https://wutheringwaves.fandom.com/wiki/Module%3AResonator_Ascensions_and_Stats%2Fdata",
      "stats_module_revision_id": 145096
    }
  },
  "source": {
    "site": "Prydwen.gg",
    "verified_at": "2026-08-28",
    "page_last_updated": "2026-08-20"
  },
  "convene_draw": "characters/zhezhi/convene_draw.png"
}
