{
  "schema_version": 1,
  "id": "lucy",
  "name": {
    "en": "Lucy"
  },
  "rarity": 5,
  "element": "spectro",
  "weapon_type": "pistols",
  "profile": {
    "description": {
      "en": "She is a part of the collaboration with Cyberpunk: Edgerunners."
    },
    "source": {
      "site": "Wuthering Waves Wiki",
      "page_url": "https://wutheringwaves.fandom.com/wiki/Lucy",
      "verified_at": "2026-10-02",
      "overview_revision_id": 97407,
      "stats_module_url": "https://wutheringwaves.fandom.com/wiki/Module%3AResonator_Ascensions_and_Stats%2Fdata",
      "stats_module_revision_id": 145096
    }
  },
  "source": {
    "site": "Prydwen.gg",
    "verified_at": "2026-08-28",
    "page_last_updated": "2026-08-20"
  },
  "convene_draw": "characters/lucy/convene_draw.png"
}
