{
  "schema_version": 1,
  "id": "sigrika",
  "name": {
    "en": "Sigrika"
  },
  "rarity": 5,
  "element": "aero",
  "weapon_type": "gauntlets",
  "profile": {
    "description": {
      "en": "She is a student in the Preparatory Program at Startorch Academy and a member of its Birding Fan Club as well as a Solsworn from the Roya Tribe. Although she shoulders the heavy responsibility of being a Heliodic Six Successor, she is an overwhelmingly kind and gentle woman dedicated to helping her classmates through their struggles."
    },
    "max_level_stats": {
      "level": 90,
      "hp": 10775.0,
      "attack": 437.5,
      "defense": 1136.65
    },
    "source": {
      "site": "Wuthering Waves Wiki",
      "page_url": "https://wutheringwaves.fandom.com/wiki/Sigrika",
      "verified_at": "2026-10-02",
      "overview_revision_id": 136636,
      "stats_module_url": "https://wutheringwaves.fandom.com/wiki/Module%3AResonator_Ascensions_and_Stats%2Fdata",
      "stats_module_revision_id": 145096
    }
  },
  "source": {
    "site": "Prydwen.gg",
    "verified_at": "2026-08-28",
    "page_last_updated": "2026-08-20"
  },
  "convene_draw": "characters/sigrika/convene_draw.png"
}
