{
  "schema_version": 1,
  "id": "jianxin",
  "name": {
    "en": "Jianxin"
  },
  "rarity": 5,
  "element": "aero",
  "weapon_type": "gauntlets",
  "profile": {
    "description": {
      "en": "As a Taoist monk and successor to the art of Fengyiquan she has dedicated her life to mastering the ultimate martial art."
    },
    "max_level_stats": {
      "level": 90,
      "hp": 14112.5,
      "attack": 337.5,
      "defense": 1124.42
    },
    "source": {
      "site": "Wuthering Waves Wiki",
      "page_url": "https://wutheringwaves.fandom.com/wiki/Jianxin",
      "verified_at": "2026-10-02",
      "overview_revision_id": 92941,
      "stats_module_url": "https://wutheringwaves.fandom.com/wiki/Module%3AResonator_Ascensions_and_Stats%2Fdata",
      "stats_module_revision_id": 145096
    }
  },
  "source": {
    "site": "Prydwen.gg",
    "verified_at": "2026-08-28",
    "page_last_updated": "2026-08-20"
  },
  "convene_draw": "characters/jianxin/convene_draw.png"
}
