{
  "schema_version": 1,
  "id": "lupa",
  "name": {
    "en": "Lupa"
  },
  "rarity": 5,
  "element": "fusion",
  "weapon_type": "broadblade",
  "profile": {
    "description": {
      "en": "She is a gladiator from Septimont, a warrior and undefeated champion of the arena with both an untamed, competitive spirit and an honorable, valiant heart. While indulging in the adrenaline of hard-fought victories, she is also a loyal, prideful protector of her city and upholds its values with everything she holds dear."
    },
    "max_level_stats": {
      "level": 90,
      "hp": 11912.5,
      "attack": 387.5,
      "defense": 1185.53
    },
    "source": {
      "site": "Wuthering Waves Wiki",
      "page_url": "https://wutheringwaves.fandom.com/wiki/Lupa",
      "verified_at": "2026-10-02",
      "overview_revision_id": 137570,
      "stats_module_url": "https://wutheringwaves.fandom.com/wiki/Module%3AResonator_Ascensions_and_Stats%2Fdata",
      "stats_module_revision_id": 145096
    }
  },
  "source": {
    "site": "Prydwen.gg",
    "verified_at": "2026-08-28",
    "page_last_updated": "2026-08-20"
  },
  "convene_draw": "characters/lupa/convene_draw.png"
}
