{
  "schema_version": 1,
  "id": "denia",
  "name": {
    "en": "Denia"
  },
  "rarity": 5,
  "element": "fusion",
  "weapon_type": "rectifier",
  "profile": {
    "description": {
      "en": "She is a student from Startorch Academy's Department of Voidmatters with a sardonic nihilism, who secretly serves as an agent for the Fractsidus. Despite being created by Schwarzloch for the purpose of becoming the Resonator of the Threnodian Aleph-1, she harbors deep-seated fear and resentment towards the Fractsidus and her creator. No matter the price, even her own existence, she is determined to use her \"gift\" to protect those dearest to her."
    },
    "max_level_stats": {
      "level": 90,
      "hp": 11025.0,
      "attack": 425.0,
      "defense": 1148.87
    },
    "source": {
      "site": "Wuthering Waves Wiki",
      "page_url": "https://wutheringwaves.fandom.com/wiki/Denia",
      "verified_at": "2026-10-02",
      "overview_revision_id": 142465,
      "stats_module_url": "https://wutheringwaves.fandom.com/wiki/Module%3AResonator_Ascensions_and_Stats%2Fdata",
      "stats_module_revision_id": 145096
    }
  },
  "source": {
    "site": "Prydwen.gg",
    "verified_at": "2026-08-28",
    "page_last_updated": "2026-08-20"
  },
  "convene_draw": "characters/denia/convene_draw.png"
}
