{
  "schema_version": 1,
  "id": "youhu",
  "name": {
    "en": "Youhu"
  },
  "rarity": 4,
  "element": "glacio",
  "weapon_type": "gauntlets",
  "profile": {
    "description": {
      "en": "She is an antiquarian from Huanglong."
    },
    "max_level_stats": {
      "level": 90,
      "hp": 9975.0,
      "attack": 262.5,
      "defense": 1051.09
    },
    "source": {
      "site": "Wuthering Waves Wiki",
      "page_url": "https://wutheringwaves.fandom.com/wiki/Youhu",
      "verified_at": "2026-10-02",
      "overview_revision_id": 99243,
      "stats_module_url": "https://wutheringwaves.fandom.com/wiki/Module%3AResonator_Ascensions_and_Stats%2Fdata",
      "stats_module_revision_id": 145096
    }
  },
  "source": {
    "site": "Prydwen.gg",
    "verified_at": "2026-08-28",
    "page_last_updated": "2026-08-20"
  },
  "convene_draw": "characters/youhu/convene_draw.png"
}
