{
  "schema_version": 1,
  "id": "yangyang_xuanling",
  "name": {
    "en": "Yangyang Xuanling"
  },
  "rarity": 5,
  "element": "havoc",
  "weapon_type": "sword",
  "profile": {
    "description": {
      "en": "Once an Outrider for the Midnight Rangers, she's now an acting Xuan Watcher of Xuanfang Hold."
    },
    "max_level_stats": {
      "level": 90,
      "hp": 11025.0,
      "attack": 425.0,
      "defense": 1148.87
    },
    "source": {
      "site": "Wuthering Waves Wiki",
      "page_url": "https://wutheringwaves.fandom.com/wiki/Yangyang%3A_Xuanling",
      "verified_at": "2026-10-02",
      "overview_revision_id": 135480,
      "stats_module_url": "https://wutheringwaves.fandom.com/wiki/Module%3AResonator_Ascensions_and_Stats%2Fdata",
      "stats_module_revision_id": 145096
    }
  },
  "source": {
    "site": "Prydwen.gg",
    "verified_at": "2026-08-28",
    "page_last_updated": "2026-08-20"
  },
  "convene_draw": "characters/yangyang_xuanling/convene_draw.png"
}
